{
  "schema_version": "0.1.0",
  "table_id": "vision-table-001",
  "state_version": 1,
  "source": "user-provided-vision-sample",
  "coordinate_frame": {
    "units": "mm",
    "origin": "table_center",
    "x_axis": "table_width",
    "y_axis": "table_length",
    "positive_x": "inherited_from_vision",
    "positive_y": "inherited_from_vision",
    "orientation_status": "provisional"
  },
  "table_geometry": {
    "active_length_mm": 2540,
    "active_width_mm": 1270
  },
  "balls": [
    {"id": 0, "x_mm": -104.72715759277344, "y_mm": -515.1940307617188},
    {"id": 1, "x_mm": 608.425, "y_mm": 937.533935546875},
    {"id": 2, "x_mm": 608.425, "y_mm": 505.4737243652344},
    {"id": 3, "x_mm": 169.01455688476562, "y_mm": 323.2037353515625},
    {"id": 4, "x_mm": -608.425, "y_mm": -334.5721130371094},
    {"id": 5, "x_mm": 608.425, "y_mm": -582.1319580078125},
    {"id": 6, "x_mm": 577.6000366210938, "y_mm": -106.50690460205078},
    {"id": 7, "x_mm": 607.1256103515625, "y_mm": -221.17320251464844},
    {"id": 8, "x_mm": 608.425, "y_mm": -840.9722900390625},
    {"id": 9, "x_mm": -608.425, "y_mm": -834.4277954101562},
    {"id": 10, "x_mm": -221.8477325439453, "y_mm": -882.8903198242188},
    {"id": 11, "x_mm": -133.2206268310547, "y_mm": -1243.425},
    {"id": 12, "x_mm": 272.2421875, "y_mm": -408.7233581542969},
    {"id": 13, "x_mm": 138.2559051513672, "y_mm": -605.556396484375},
    {"id": 14, "x_mm": -68.3559341430664, "y_mm": -172.96435546875},
    {"id": 15, "x_mm": -608.425, "y_mm": 804.388427734375}
  ]
}
